{
  "case_id": "a10c2010-2222-4b22-8333-222222222222",
  "external_ref": "EVAL-CLEAN",
  "tenant_id": "demo",
  "idempotency_key": "eval-clean-v1",
  "title": "Individual API Design Portfolio",
  "module_code": "ICT2204",
  "module_title": "Software Engineering",
  "study_level": "5",
  "credit_value": 15,
  "assessment_weight": 30,
  "assessment_type": "individual software portfolio",
  "individual_or_group": "individual",
  "formative_or_summative": "summative",
  "issue_date": "2026-06-22",
  "submission_date": "2026-08-03",
  "submitter_id": "lecturer-demo",
  "moderator_id": "moderator-demo",
  "declared_ai_mode": "guided",
  "evaluation_mode": false,
  "metadata": {
    "synthetic": true,
    "purpose": "live workshop demonstration"
  },
  "learning_outcomes": [
    {
      "outcome_code": "LO1",
      "description": "Design a maintainable software architecture for a stated organisational problem.",
      "level_descriptor": "Level 5"
    },
    {
      "outcome_code": "LO2",
      "description": "Implement and test a working software system using appropriate engineering practices.",
      "level_descriptor": "Level 5"
    },
    {
      "outcome_code": "LO3",
      "description": "Analyse security and privacy risks and implement proportionate controls.",
      "level_descriptor": "Level 5"
    }
  ],
  "artifacts": [
    {
      "artifact_type": "assessment_brief",
      "original_filename": "clean-brief.md",
      "mime_type": "text/markdown",
      "size_bytes": 520,
      "storage_bucket": "amas",
      "storage_key": "demo/6c25d5c9a6c7fa80b7bd3048623fb244104a783902004ed9ddd47aa28c1adc56-clean-brief.md",
      "sha256": "6c25d5c9a6c7fa80b7bd3048623fb244104a783902004ed9ddd47aa28c1adc56",
      "extracted_text": "ICT2204 Individual API Design Portfolio\nWeighting: 30%\nLearning outcomes assessed: LO1, LO2, LO3\nStudents design, implement, test, and security-review an API. Submit an individual repository, architecture decision records, automated test evidence, a threat model, an AI-use declaration, and complete an individual viva. Guided AI use is permitted for explanation of errors, critique, and test-case ideation. Complete solution generation is prohibited. Students must verify, cite, and disclose significant AI assistance.\n",
      "text_sha256": "6c25d5c9a6c7fa80b7bd3048623fb244104a783902004ed9ddd47aa28c1adc56",
      "extraction_status": "provided",
      "metadata": {
        "synthetic": true
      }
    },
    {
      "artifact_type": "rubric",
      "original_filename": "clean-rubric.md",
      "mime_type": "text/markdown",
      "size_bytes": 187,
      "storage_bucket": "amas",
      "storage_key": "demo/1cc36ba29aeefa0d5f678dce5003d5a7e098c320d71be751e72f07a1f173feb4-clean-rubric.md",
      "sha256": "1cc36ba29aeefa0d5f678dce5003d5a7e098c320d71be751e72f07a1f173feb4",
      "extracted_text": "Architecture decisions: 25 marks\nImplementation quality: 25 marks\nTesting evidence: 20 marks\nSecurity and privacy analysis: 20 marks\nIndividual viva and reflective verification: 10 marks\n",
      "text_sha256": "1cc36ba29aeefa0d5f678dce5003d5a7e098c320d71be751e72f07a1f173feb4",
      "extraction_status": "provided",
      "metadata": {
        "synthetic": true
      }
    },
    {
      "artifact_type": "module_descriptor",
      "original_filename": "module-descriptor.md",
      "mime_type": "text/markdown",
      "size_bytes": 320,
      "storage_bucket": "amas",
      "storage_key": "demo/4cf779b96dba62d612520d44cea3af69f3a9fffdda27e35b059db2271a95a683-module-descriptor.md",
      "sha256": "4cf779b96dba62d612520d44cea3af69f3a9fffdda27e35b059db2271a95a683",
      "extracted_text": "ICT2204 Module Descriptor\nAssessment weighting: 30%\nCredits: 15\n\nLO1: Design a maintainable software architecture for a stated organisational problem.\nLO2: Implement and test a working software system using appropriate engineering practices.\nLO3: Analyse security and privacy risks and implement proportionate controls.\n",
      "text_sha256": "4cf779b96dba62d612520d44cea3af69f3a9fffdda27e35b059db2271a95a683",
      "extraction_status": "provided",
      "metadata": {
        "synthetic": true
      }
    }
  ]
}
